{
  "v": 1,
  "catalogue_version": "1.0.0",
  "status": "frozen",
  "is_estimate": true,
  "air_unit": {
    "definition": "1 AIR = the health damage avoided by removing 1 mg of PM2.5 (1 mg PM2.5-equivalent).",
    "reference_pollutant": "pm25",
    "source": "CE Delft, Environmental Prices Handbook (EU28 version), Table 1, central values, EUR2015 per kg"
  },
  "pollutants": {
    "pm25": {
      "name": "PM2.5",
      "weight": 1.0,
      "damage_cost_eur_per_kg": 38.7,
      "concentration_unit": "ug/m3",
      "ref_concentration": 35
    },
    "pm10": {
      "name": "PM10",
      "weight": 0.69,
      "damage_cost_eur_per_kg": 26.6,
      "concentration_unit": "ug/m3",
      "ref_concentration": 50
    },
    "no2": {
      "name": "NOx (NO2)",
      "weight": 0.38,
      "damage_cost_eur_per_kg": 14.8,
      "concentration_unit": "ppb",
      "ref_concentration": 25
    },
    "so2": {
      "name": "SO2",
      "weight": 0.3,
      "damage_cost_eur_per_kg": 11.5,
      "concentration_unit": "ppb",
      "ref_concentration": 10
    },
    "voc": {
      "name": "VOCs (benzene, formaldehyde and others)",
      "weight": 0.03,
      "damage_cost_eur_per_kg": 1.15,
      "concentration_unit": "voc_index",
      "ref_concentration": 100
    },
    "co2": {
      "name": "CO2",
      "weight": 0.0015,
      "damage_cost_eur_per_kg": 0.057,
      "concentration_unit": "ppm",
      "ref_concentration": 420
    },
    "co": {
      "name": "CO",
      "weight": 0.0014,
      "damage_cost_eur_per_kg": 0.0526,
      "concentration_unit": "ppm",
      "ref_concentration": 1
    }
  },
  "multiplier_levels": {
    "high": 1.5,
    "medium": 1.0,
    "low": 0.5
  },
  "base_rates_mg_per_m2_h": {
    "pm25": 0.25,
    "pm10": 1.0,
    "no2": 0.17,
    "so2": 0.47,
    "voc": 0.5,
    "co2": 300.0,
    "co": 0.04
  },
  "concentration_factor_cap": 5,
  "caps": {
    "per_plant_air_per_epoch": 0.01,
    "per_miner_air_per_epoch": 0.2
  },
  "species": [
    {
      "id": "snake_plant",
      "number": 1,
      "common_name": "Snake plant",
      "scientific_name": "Dracaena trifasciata",
      "placement": "indoor",
      "main_targets": "Benzene, formaldehyde, TCE, xylene; CO2 at night",
      "multipliers": {
        "pm25": "low",
        "pm10": "low",
        "no2": "low",
        "so2": "low",
        "voc": "high",
        "co2": "high",
        "co": "low"
      },
      "evidence": {
        "summary": "NASA Clean Air Study (Wolverton et al., 1989)",
        "status": "cited"
      },
      "reference_images": [],
      "toxic": false
    },
    {
      "id": "peace_lily",
      "number": 2,
      "common_name": "Peace lily",
      "scientific_name": "Spathiphyllum wallisii",
      "placement": "indoor",
      "main_targets": "Benzene, TCE, formaldehyde, ammonia",
      "multipliers": {
        "pm25": "low",
        "pm10": "low",
        "no2": "low",
        "so2": "low",
        "voc": "high",
        "co2": "low",
        "co": "low"
      },
      "evidence": {
        "summary": "NASA Clean Air Study (Wolverton et al., 1989)",
        "status": "cited"
      },
      "reference_images": [],
      "toxic": false
    },
    {
      "id": "bamboo_palm",
      "number": 3,
      "common_name": "Bamboo palm",
      "scientific_name": "Chamaedorea seifrizii",
      "placement": "indoor",
      "main_targets": "Formaldehyde, benzene, TCE",
      "multipliers": {
        "pm25": "low",
        "pm10": "low",
        "no2": "low",
        "so2": "low",
        "voc": "high",
        "co2": "low",
        "co": "low"
      },
      "evidence": {
        "summary": "NASA Clean Air Study (Wolverton et al., 1989)",
        "status": "cited"
      },
      "reference_images": [],
      "toxic": false
    },
    {
      "id": "red_edged_dracaena",
      "number": 4,
      "common_name": "Red-edged dracaena",
      "scientific_name": "Dracaena marginata",
      "placement": "indoor",
      "main_targets": "Benzene, TCE, formaldehyde, xylene",
      "multipliers": {
        "pm25": "low",
        "pm10": "low",
        "no2": "low",
        "so2": "low",
        "voc": "high",
        "co2": "low",
        "co": "low"
      },
      "evidence": {
        "summary": "NASA Clean Air Study (Wolverton et al., 1989)",
        "status": "cited"
      },
      "reference_images": [],
      "toxic": false
    },
    {
      "id": "janet_craig_dracaena",
      "number": 5,
      "common_name": "Janet Craig dracaena",
      "scientific_name": "Dracaena fragrans 'Janet Craig'",
      "placement": "indoor",
      "main_targets": "Formaldehyde, benzene, TCE",
      "multipliers": {
        "pm25": "low",
        "pm10": "low",
        "no2": "low",
        "so2": "low",
        "voc": "high",
        "co2": "low",
        "co": "low"
      },
      "evidence": {
        "summary": "NASA Clean Air Study (Wolverton et al., 1989)",
        "status": "cited"
      },
      "reference_images": [],
      "toxic": false
    },
    {
      "id": "english_ivy",
      "number": 6,
      "common_name": "English ivy",
      "scientific_name": "Hedera helix",
      "placement": "indoor",
      "main_targets": "Benzene, formaldehyde, TCE",
      "multipliers": {
        "pm25": "low",
        "pm10": "low",
        "no2": "low",
        "so2": "low",
        "voc": "high",
        "co2": "low",
        "co": "low"
      },
      "evidence": {
        "summary": "NASA Clean Air Study (Wolverton et al., 1989)",
        "status": "cited"
      },
      "reference_images": [],
      "toxic": false
    },
    {
      "id": "chinese_evergreen",
      "number": 7,
      "common_name": "Chinese evergreen",
      "scientific_name": "Aglaonema modestum",
      "placement": "indoor",
      "main_targets": "Benzene, formaldehyde",
      "multipliers": {
        "pm25": "low",
        "pm10": "low",
        "no2": "low",
        "so2": "low",
        "voc": "high",
        "co2": "low",
        "co": "low"
      },
      "evidence": {
        "summary": "NASA Clean Air Study (Wolverton et al., 1989)",
        "status": "cited"
      },
      "reference_images": [],
      "toxic": false
    },
    {
      "id": "florists_chrysanthemum",
      "number": 8,
      "common_name": "Florist's chrysanthemum",
      "scientific_name": "Chrysanthemum morifolium",
      "placement": "indoor_or_balcony",
      "main_targets": "Benzene, formaldehyde, ammonia",
      "multipliers": {
        "pm25": "low",
        "pm10": "low",
        "no2": "low",
        "so2": "low",
        "voc": "high",
        "co2": "low",
        "co": "low"
      },
      "evidence": {
        "summary": "NASA Clean Air Study (Wolverton et al., 1989)",
        "status": "cited"
      },
      "reference_images": [],
      "toxic": false
    },
    {
      "id": "weeping_fig",
      "number": 9,
      "common_name": "Weeping fig",
      "scientific_name": "Ficus benjamina",
      "placement": "indoor",
      "main_targets": "Formaldehyde, xylene, toluene",
      "multipliers": {
        "pm25": "low",
        "pm10": "low",
        "no2": "low",
        "so2": "low",
        "voc": "high",
        "co2": "low",
        "co": "low"
      },
      "evidence": {
        "summary": "NASA Clean Air Study (Wolverton et al., 1989)",
        "status": "cited"
      },
      "reference_images": [],
      "toxic": false
    },
    {
      "id": "money_plant",
      "number": 10,
      "common_name": "Money plant",
      "scientific_name": "Epipremnum aureum",
      "placement": "indoor",
      "main_targets": "Formaldehyde, benzene",
      "multipliers": {
        "pm25": "low",
        "pm10": "low",
        "no2": "low",
        "so2": "low",
        "voc": "high",
        "co2": "low",
        "co": "low"
      },
      "evidence": {
        "summary": "Widely cited; confirm a paper",
        "status": "to_confirm"
      },
      "reference_images": [],
      "toxic": false
    },
    {
      "id": "spider_plant",
      "number": 11,
      "common_name": "Spider plant",
      "scientific_name": "Chlorophytum comosum",
      "placement": "indoor",
      "main_targets": "Formaldehyde, CO",
      "multipliers": {
        "pm25": "low",
        "pm10": "low",
        "no2": "low",
        "so2": "low",
        "voc": "high",
        "co2": "low",
        "co": "high"
      },
      "evidence": {
        "summary": "Widely cited; confirm a paper",
        "status": "to_confirm"
      },
      "reference_images": [],
      "toxic": false
    },
    {
      "id": "aloe_vera",
      "number": 12,
      "common_name": "Aloe vera",
      "scientific_name": "Aloe barbadensis",
      "placement": "indoor_or_balcony",
      "main_targets": "Formaldehyde; CO2 at night",
      "multipliers": {
        "pm25": "low",
        "pm10": "low",
        "no2": "low",
        "so2": "low",
        "voc": "high",
        "co2": "high",
        "co": "low"
      },
      "evidence": {
        "summary": "Widely cited; confirm a paper",
        "status": "to_confirm"
      },
      "reference_images": [],
      "toxic": false
    },
    {
      "id": "areca_palm",
      "number": 13,
      "common_name": "Areca palm",
      "scientific_name": "Dypsis lutescens",
      "placement": "indoor",
      "main_targets": "CO2 (large leaf area)",
      "multipliers": {
        "pm25": "low",
        "pm10": "low",
        "no2": "low",
        "so2": "low",
        "voc": "low",
        "co2": "high",
        "co": "low"
      },
      "evidence": {
        "summary": "Widely cited; confirm a paper",
        "status": "to_confirm"
      },
      "reference_images": [],
      "toxic": false
    },
    {
      "id": "boston_fern",
      "number": 14,
      "common_name": "Boston fern",
      "scientific_name": "Nephrolepis exaltata",
      "placement": "indoor",
      "main_targets": "Formaldehyde",
      "multipliers": {
        "pm25": "low",
        "pm10": "low",
        "no2": "low",
        "so2": "low",
        "voc": "high",